{
  "key": "dungeon",
  "version": 2,
  "name": "地城復古道具",
  "description": "深色石材、鐵器、火光與復古 RPG 地城素材。",
  "target": {
    "asset_type": "single_sprite",
    "resolution": "64x64",
    "final_grid": "16x16",
    "views": ["top-down", "side-view", "isometric"]
  },
  "prompt": {
    "subject_template": "A single standalone game item sprite of {{subject}}.",
    "base": "Centered isolated object, full object visible, readable silhouette, chunky 16-bit pixel art, crisp dark outline, hard pixel-art edges, strict 8-color low-color pixel art.",
    "style": "Retro dungeon RPG asset, sturdy stone, worn iron, aged leather, bone, ember, rune, or treasure materials only when they are part of the requested object.",
    "composition": "Compact game icon composition, the requested object is the only focal element, no floating detached loot, rubble, sparks, or background props outside the main silhouette.",
    "containment": "The entire subject must fit fully inside the canvas, leave solid magenta margin on all four sides, no ember, smoke, chain, blade tip, bone, rune, or decoration may touch or cross the canvas edge.",
    "palette": "Use exactly the dungeon 8-color family: black outline, deep violet shadow, stone midtone, pale bone highlight, dark leather brown, worn bronze, ember red-brown, orange fire accent.",
    "background": "Background is 100% solid flat magenta (#FF00FF), no gradients, no shadow under the object, no scenery, no pattern, magenta background only.",
    "quality": "Strong silhouette, heavy shadow shapes, clear material separation, readable at small icon size, compressed tones using one shadow, one midtone, and one highlight family.",
    "forbidden": "NO text, NO labels, NO words, NO letters, NO UI, NO speech bubbles, NO background items, NO extra loose materials."
  },
  "palette": {
    "palette_key": "dungeon-8",
    "enforce": true,
    "allow_highlight_slots": 1
  },
  "processors": {
    "default": ["bg_remover", "alpha_trimmer", "perfect_pixel", "palette_mapper", "thumbnail"],
    "config": {
      "bg_remover": {
        "method": "magenta",
        "threshold": 100,
        "edge_threshold": 150
      },
      "perfect_pixel": {
        "target_size": "none",
        "sample_method": "adaptive",
        "remove_outliers": true
      },
      "palette_mapper": {
        "mode": "palette",
        "palette_key": "dungeon-8",
        "dither": true,
        "dither_strength": 0.5
      }
    }
  }
}
