{
  "key": "arcane_craft",
  "version": 2,
  "name": "奧術工藝",
  "description": "魔法工藝、紫金色調、奧術符文與手作器物。",
  "target": {
    "asset_type": "single_sprite",
    "resolution": "64x64",
    "final_grid": "16x16",
    "views": ["top-down", "side-view", "isometric"]
  },
  "prompt": {
    "subject_template": "A single standalone game item sprite of {{subject}}.",
    "base": "Centered isolated object, full object visible, readable silhouette, chunky 16-bit pixel art, crisp dark outline, hard pixel-art edges, strict 8-color low-color pixel art.",
    "style": "Arcane craft fantasy asset, mystical handmade shape language, rune, crystal, brass, parchment, wax, potion, glyph, or enchanted tool materials only when they are part of the requested object.",
    "composition": "Compact game icon composition, the requested object is the only focal element, no floating detached runes, sparkles, scrolls, crystals, or background props outside the main silhouette.",
    "containment": "The entire subject must fit fully inside the canvas, leave solid magenta margin on all four sides, no glyph, spark, aura, smoke, tassel, crystal shard, or decoration may touch or cross the canvas edge.",
    "palette": "Use exactly the arcane craft 8-color family: near-black outline, deep violet shadow, royal purple, bright arcane violet, muted lavender, dark brass, gold highlight, cyan magic accent.",
    "background": "Background is 100% solid flat magenta (#FF00FF), no gradients, no shadow under the object, no scenery, no pattern, magenta background only.",
    "quality": "Elegant silhouette, clear magical focal point attached to the object, readable small icon, crisp pixel clusters, compressed tones using one shadow, one midtone, and one highlight family.",
    "forbidden": "NO text, NO labels, NO words, NO letters, NO UI, NO speech bubbles, NO background items, NO extra loose materials."
  },
  "palette": {
    "palette_key": "arcane-craft-8",
    "enforce": true,
    "allow_highlight_slots": 1
  },
  "processors": {
    "default": ["bg_remover", "perfect_pixel", "upscaler", "thumbnail"],
    "config": {
      "bg_remover": {
        "method": "magenta",
        "threshold": 100,
        "edge_threshold": 150
      },
      "perfect_pixel": {
        "target_size": "none",
        "sample_method": "center",
        "remove_outliers": true
      },
      "upscaler": {
        "scale": 10
      },
      "palette_mapper": {
        "mode": "palette",
        "palette_key": "arcane-craft-8",
        "dither": true,
        "dither_strength": 0.5
      }
    }
  }
}
